[
  {
    "gclid": "Cj0KCQjwSYNTHgclidU01",
    "gclid_created_at": 1780412260000,
    "gbraid": "0AAAAASYNTHgbraidU01",
    "gbraid_created_at": 1780412260000,
    "utm_source": "google",
    "utm_medium": "cpc",
    "utm_campaign": "synth_search_brand",
    "landing_url": "https://openart.ai/ai-model/seedance-2-5/?utm_source=google&utm_medium=cpc&utm_campaign=synth_search_brand&gclid=Cj0KCQjwSYNTHgclidU01",
    "referrer": "https://www.google.com/",
    "context_captured_at": 1780412260000
  },
  {
    "rdt_cid": "SYNTHrdtcidU04.reddit",
    "rdt_cid_created_at": 1784494800000,
    "twclid": "SYNTHtwclidU04",
    "twclid_created_at": 1784376000000,
    "li_fat_id": "4f1c2a9e-5b6d-4e8f-9a0b-aaaaa0000004",
    "li_fat_id_created_at": 1784275200000,
    "oppref": "SYNTHoppref_U04",
    "oppref_created_at": 1784495100000,
    "msclkid": "b1c2d3e4f5a6478899aa000000000004",
    "msclkid_created_at": 1784491200000,
    "referrer": "",
    "context_captured_at": 1784495100000
  }
]
